<results xmlns:xsi="http://www.w3.org/2001/XMLSchema-instance" xsi:noNamespaceSchemaLocation="results.xsd">
	<team id="1" score="213" time="22:55:29" penalty="0" gender="men" age="open" name="Yaremcha">
		<member firstname="Vasiliy" lastname="Stefurak" country="UKR" />
		<member firstname="Vasiliy" lastname="Bondarchuk" country="UKR" />
		<member firstname="Petro" lastname="Polkovnikov" country="UKR" />
	</team>
	<team id="2" score="212" time="23:24:52" penalty="0" gender="men" age="open" name="Machnovcy">
		<member firstname="Sergiy" lastname="Yaroshenko" country="UKR" />
		<member firstname="Sergiy" lastname="Sirinyuk" country="UKR" />
	</team>
	<team id="3" score="212" time="23:53:36" penalty="0" gender="men" age="open" name="Krym">
		<member firstname="Taras" lastname="Konyukhov" country="UKR" />
		<member firstname="Oleksandr" lastname="Sheshukov" country="UKR" />
	</team>
	<team id="4" score="180" time="21:43:55" penalty="0" gender="men" age="junior" name="??lush_1">
		<member firstname="Sergiy" lastname="Mospan" country="UKR" />
		<member firstname="Mikola" lastname="Kovbasyuk" country="UKR" />
	</team>
	<team id="5" score="178" time="23:24:11" penalty="0" gender="men" age="open" name="Inter SSM-2">
		<member firstname="Oleksandr" lastname="Buligin" country="UKR" />
		<member firstname="Sergiy" lastname="Vasilkov" country="UKR" />
	</team>
	<team id="6" score="174" time="22:18:25" penalty="0" gender="men" age="open" name="Inter SSM-1">
		<member firstname="Pavlo" lastname="Buligin" country="UKR" />
		<member firstname="Mikhailo" lastname="Arsenyuk" country="UKR" />
	</team>
	<team id="7" score="171" time="22:14:03" penalty="0" gender="men" age="junior" name="??lush_2">
		<member firstname="Volodimir" lastname="Zyatik" country="UKR" />
		<member firstname="Andriy" lastname="Gudz" country="UKR" />
	</team>
	<team id="8" score="154" time="23:53:59" penalty="0" gender="men" age="open" name="MIDIZ_1">
		<member firstname="Oleksandr" lastname="Mikhailov" country="UKR" />
		<member firstname="Viktor" lastname="Mikhailov" country="UKR" />
	</team>
	<team id="9" score="149" time="22:57:22" penalty="0" gender="men" age="superveteran" name="Aksakali">
		<member firstname="Valeriy" lastname="Shulga" country="UKR" />
		<member firstname="Tanasiy" lastname="Makoviytchuk" country="UKR" />
	</team>
	<team id="10" score="133" time="20:14:00" penalty="0" gender="men" age="open" name="Meridian">
		<member firstname="Volodimir" lastname="Lkpulyak" country="UKR" />
		<member firstname="Dmitro" lastname="Sandul" country="UKR" />
		<member firstname="Igor" lastname="Zerya" country="UKR" />
	</team>
	<team id="11" score="132" time="23:17:08" penalty="0" gender="men" age="open" name="Gold Star">
		<member firstname="Mikola" lastname="Bazarov" country="UKR" />
		<member firstname="Dmitro" lastname="Kisakov" country="UKR" />
	</team>
	<team id="12" score="130" time="23:02:53" penalty="0" gender="men" age="junior" name="Vinnicija-1">
		<member firstname="Dmitro" lastname="Kozel" country="UKR" />
		<member firstname="Sergiy" lastname="Nagornyuk" country="UKR" />
		<member firstname="Roman" lastname="Simonishin" country="UKR" />
	</team>
	<team id="13" score="111" time="22:55:28" penalty="0" gender="men" age="open" name="Migovo">
		<member firstname="Dmitro" lastname="Olievskiy" country="UKR" />
		<member firstname="Ruslan" lastname="Oliyevskiy" country="UKR" />
	</team>
	<team id="14" score="80" time="10:49:50" penalty="0" gender="men" age="veteran" name="Atrerium">
		<member firstname="Mikola" lastname="Kovaltchuk" country="UKR" />
		<member firstname="Sergiy" lastname="Sur" country="UKR" />
	</team>
	<team id="15" score="79" time="13:46:11" penalty="0" gender="men" age="junior" name="Maximum-2">
		<member firstname="Sergiy" lastname="Brilinskiy" country="UKR" />
		<member firstname="Bogdan" lastname="Kobelyanskiy" country="UKR" />
	</team>
	<team id="16" score="67" time="22:59:00" penalty="0" gender="men" age="junior" name="CHIP">
		<member firstname="Ivan" lastname="Khrapko" country="UKR" />
		<member firstname="Dmitro" lastname="Poburian" country="UKR" />
	</team>
	<team id="17" score="47" time="6:39:46" penalty="0" gender="men" age="junior" name="Maximum-3">
		<member firstname="XXX" lastname="Novoselcev" country="UKR" />
		<member firstname="XXX" lastname="Rokhmanov" country="UKR" />
	</team>
	<team id="18" score="38" time="8:06:54" penalty="0" gender="men" age="junior" name="Mandriki">
		<member firstname="Andriy" lastname="Kelya" country="UKR" />
		<member firstname="Vyacheslav" lastname="Kelya" country="UKR" />
	</team>
	<team id="19" score="35" time="21:20:10" penalty="0" gender="men" age="junior" name="2?">
		<member firstname="Vitaliy" lastname="Karamishev" country="UKR" />
		<member firstname="Ilya" lastname="Motryuk" country="UKR" />
	</team>
	<team id="20" score="26" time="7:10:08" penalty="0" gender="men" age="open" name="Migovo2">
		<member firstname="Oleksandr" lastname="Voloshin" country="UKR" />
		<member firstname="Maksim" lastname="Kurishev" country="UKR" />
	</team>
	<team id="21" score="155" time="20:25:06" penalty="0" gender="men" age="open" name="Nutrend">
		<member firstname="Ruslan" lastname="Shimtchuk" country="UKR" />
		<member firstname="Vyacheslav" lastname="Shimtchuk" country="UKR" />
	</team>
	<team id="22" score="165" time="24:21:33" penalty="0" gender="men" age="open" name="Maximum-1">
		<member firstname="Georgiy" lastname="Fetcho" country="UKR" />
	</team>
	<team id="23" score="80" time="25:38:25" penalty="0" gender="men" age="open" name="">
		<member firstname="Andriy" lastname="Bilce" country="UKR" />
	</team>
	<team id="24" score="181" time="23:14:14" penalty="0" gender="mixed" age="junior" name="Vinnicija_4">
		<member firstname="Polina" lastname="Zakharova" country="UKR" />
		<member firstname="Volodymyr" lastname="Bezditniy" country="UKR" />
	</team>
	<team id="25" score="172" time="23:27:21" penalty="0" gender="mixed" age="open" name="Vinnicija_5">
		<member firstname="Oleksandr" lastname="Marchuk" country="UKR" />
		<member firstname="Bogdan" lastname="Grelya" country="UKR" />
		<member firstname="Lena" lastname="Mironenko" country="UKR" />
	</team>
	<team id="26" score="164" time="22:44:13" penalty="0" gender="mixed" age="junior" name="MIDIZ_2">
		<member firstname="Vyacheslav" lastname="Demtchenko" country="UKR" />
		<member firstname="Yuriy" lastname="Richlo" country="UKR" />
		<member firstname="Anna Polina" lastname="Ivantchak" country="UKR" />
		<member firstname="Vadim" lastname="Chomenko" country="UKR" />
	</team>
	<team id="27" score="145" time="21:51:02" penalty="0" gender="mixed" age="open" name="Lviv">
		<member firstname="Andriy" lastname="Tkatch" country="UKR" />
		<member firstname="Christina" lastname="Ustyanovska" country="UKR" />
	</team>
	<team id="28" score="80" time="23:30:52" penalty="0" gender="mixed" age="superveteran" name="Alchevskije mandrivniki">
		<member firstname="Yuriy" lastname="Shur" country="UKR" />
		<member firstname="Tetyana" lastname="Dritova" country="UKR" />
	</team>
	<team id="29" score="70" time="20:40:01" penalty="0" gender="mixed" age="open" name="Kharkiv-2">
		<member firstname="Dmitro" lastname="Kovriga" country="UKR" />
		<member firstname="Karolina" lastname="Shpartina" country="UKR" />
	</team>
	<team id="30" score="51" time="8:57:33" penalty="0" gender="mixed" age="open" name="Kharkiv-4">
		<member firstname="XXX" lastname="Svyatishinko" country="UKR" />
		<member firstname="Ira" lastname="Glushko" country="UKR" />
	</team>
	<team id="31" score="43" time="5:52:26" penalty="0" gender="mixed" age="junior" name="Vinnicija-3">
		<member firstname="Oleksandr" lastname="Kovalinskiy" country="UKR" />
		<member firstname="Anastasia" lastname="Basyuk" country="UKR" />
	</team>
	<team id="32" score="168" time="23:40:04" penalty="0" gender="women" age="open" name="Vinnicija-2">
		<member firstname="Lyudmila" lastname="Yaremenko" country="UKR" />
		<member firstname="Olga" lastname="Mazur" country="UKR" />
	</team>
	<team id="33" score="147" time="23:58:54" penalty="0" gender="women" age="open" name="Leader">
		<member firstname="Yulia" lastname="Soroka" country="UKR" />
		<member firstname="Natalia" lastname="Troyanovska" country="UKR" />
	</team>
	<team id="34" score="120" time="22:24:10" penalty="0" gender="women" age="junior" name="Shvidkist">
		<member firstname="Natalia" lastname="Shelepyuk" country="UKR" />
		<member firstname="Maria" lastname="Sokolovska" country="UKR" />
	</team>
	<team id="35" score="84" time="23:15:59" penalty="0" gender="women" age="veteran" name="Osvitjani">
		<member firstname="Antonina" lastname="Tumak" country="UKR" />
		<member firstname="Valentina" lastname="Bevzo" country="UKR" />
	</team>
	<team id="36" score="25" time="8:21:50" penalty="0" gender="women" age="junior" name="Targani">
		<member firstname="Anastasia" lastname="Chistyakova" country="UKR" />
		<member firstname="Anastasia" lastname="Strutinska" country="UKR" />
	</team>
	<team id="37" score="16" time="8:08:25" penalty="0" gender="women" age="open" name="Anki">
		<member firstname="Anna" lastname="Slizkova" country="UKR" />
		<member firstname="Anna" lastname="Ivanova" country="UKR" />
	</team>
	<team id="38" score="11" time="5:54:09" penalty="0" gender="women" age="open" name="Kharkiv-3">
		<member firstname="Maria" lastname="Kobzeva" country="UKR" />
		<member firstname="Natalia" lastname="Stepanyanc" country="UKR" />
	</team>
</results>
